{
  "schema": 2,
  "role": "integrator",
  "status": "completed",
  "head": "916dffcd5dc9abf53dc2082ecd8e4dcbe71359ae",
  "produced_at": "2026-08-29T18:00:00Z",
  "producer": {
    "harness": "claude-code",
    "model": "claude-sonnet-5",
    "tier": "standard"
  },
  "run": {
    "run_id": "run-4001-verdict-clean",
    "initiated_by": "human"
  },
  "payload": {
    "checks": [
      {
        "name": "ci/build",
        "bucket": "pass",
        "run_id": "1001",
        "required": true
      },
      {
        "name": "ci/test",
        "bucket": "pass",
        "run_id": "1002",
        "required": true
      },
      {
        "name": "ci/optional-lint",
        "bucket": "skipping",
        "run_id": "1006",
        "required": false
      }
    ],
    "codex_cycle": {
      "head": "916dffcd5dc9abf53dc2082ecd8e4dcbe71359ae",
      "cycle": 2,
      "attempt": 1,
      "trigger_comment_id": "555000111",
      "exit_code": 0,
      "accepted": {
        "surface": "review",
        "id": "777888",
        "reviewed_commit": "916dffcd5dc9abf53dc2082ecd8e4dcbe71359ae"
      },
      "charged": 1,
      "exempt": 1
    },
    "integration_round": 1,
    "findings": [],
    "unanswered_thread_roots": [],
    "settled_at": "2026-08-29T18:00:00Z",
    "verdict": "clean",
    "applied_dispositions": [],
    "finder_cycles": [
      {
        "finder": "codex-cloud",
        "head": "916dffcd5dc9abf53dc2082ecd8e4dcbe71359ae",
        "cycle": 2,
        "attempt": 1,
        "trigger_comment_id": "555000111",
        "exit_code": 0,
        "accepted": {
          "surface": "review",
          "id": "777888",
          "reviewed_commit": "916dffcd5dc9abf53dc2082ecd8e4dcbe71359ae"
        },
        "charged": 1,
        "exempt": 1
      }
    ]
  }
}
