{
  "schema": 2,
  "role": "integrator",
  "status": "completed",
  "head": "6060a1b2c3d4e5f6a1b2c3d4e5f6a1b2c3d4e5f6",
  "produced_at": "2026-08-29T19:00:00Z",
  "producer": {
    "harness": "claude-code",
    "model": "claude-sonnet-5",
    "tier": "standard"
  },
  "run": {
    "run_id": "run-6060-integration-adjudication",
    "initiated_by": "human"
  },
  "payload": {
    "checks": [{ "name": "ci/build", "bucket": "pass", "run_id": "2001", "required": true }],
    "codex_cycle": null,
    "integration_round": 1,
    "findings": [
      {
        "id": "integration-r1-human-1",
        "body": "Please add a regression test for the empty-array case.",
        "source_id": "review-1234500001"
      }
    ],
    "unanswered_thread_roots": [],
    "settled_at": "2026-08-29T19:00:00Z",
    "verdict": "findings"
  }
}
